{
  "case_id": "SYNTHETIC-FILTER-001",
  "title": "虚构演示过滤件更换 SOP（仅供测试）",
  "version": 2,
  "evidence_catalog": [
    {
      "evidence_id": "E001",
      "source_type": "video",
      "source_ref": "synthetic/demo_operation.mp4",
      "claim": "开始前清理工作区并放置警示牌。",
      "locator": {"start_ms": 0, "end_ms": 8000, "keyframe": "frames/0004.jpg"},
      "classification": "SOURCE_FACT",
      "relevance": 0.94,
      "confidence": 0.96,
      "review_status": "VERIFIED"
    },
    {
      "evidence_id": "E002",
      "source_type": "pdf",
      "source_ref": "synthetic/demo_manual.pdf",
      "claim": "维护前关闭电源并挂牌，确认设备无运行指示。",
      "locator": {"page": 2, "paragraph": "安全准备 2.1"},
      "classification": "SOURCE_FACT",
      "relevance": 1.0,
      "confidence": 0.99,
      "review_status": "VERIFIED"
    },
    {
      "evidence_id": "E003",
      "source_type": "audio",
      "source_ref": "synthetic/expert_note.wav",
      "claim": "断电后应等待运行指示完全熄灭再继续。",
      "locator": {"start_ms": 9000, "end_ms": 17000},
      "classification": "EXPERT_ADVICE",
      "relevance": 0.96,
      "confidence": 0.95,
      "review_status": "VERIFIED"
    },
    {
      "evidence_id": "E004",
      "source_type": "pdf",
      "source_ref": "synthetic/demo_manual.pdf",
      "claim": "打开维护盖板前佩戴手套和护目镜。",
      "locator": {"page": 3, "paragraph": "个人防护 3.1"},
      "classification": "SOURCE_FACT",
      "relevance": 0.98,
      "confidence": 0.99,
      "review_status": "VERIFIED"
    },
    {
      "evidence_id": "E005",
      "source_type": "video",
      "source_ref": "synthetic/demo_operation.mp4",
      "claim": "操作者向上打开维护盖板。",
      "locator": {"start_ms": 26000, "end_ms": 34000, "keyframe": "frames/0030.jpg"},
      "classification": "SOURCE_FACT",
      "relevance": 0.93,
      "confidence": 0.94,
      "review_status": "VERIFIED"
    },
    {
      "evidence_id": "E006",
      "source_type": "video",
      "source_ref": "synthetic/demo_operation.mp4",
      "claim": "依次松开左右两个过滤件卡扣。",
      "locator": {"start_ms": 35000, "end_ms": 44000, "keyframe": "frames/0040.jpg"},
      "classification": "SOURCE_FACT",
      "relevance": 0.94,
      "confidence": 0.95,
      "review_status": "VERIFIED"
    },
    {
      "evidence_id": "E007",
      "source_type": "video",
      "source_ref": "synthetic/demo_operation.mp4",
      "claim": "将旧过滤件水平拉出并立即装入密封袋。",
      "locator": {"start_ms": 45000, "end_ms": 56000, "keyframe": "frames/0050.jpg"},
      "classification": "SOURCE_FACT",
      "relevance": 0.97,
      "confidence": 0.96,
      "review_status": "VERIFIED"
    },
    {
      "evidence_id": "E008",
      "source_type": "audio",
      "source_ref": "synthetic/expert_note.wav",
      "claim": "旧过滤件不要抖动，以免残留物散落。",
      "locator": {"start_ms": 20000, "end_ms": 27000},
      "classification": "EXPERT_ADVICE",
      "relevance": 0.9,
      "confidence": 0.92,
      "review_status": "VERIFIED"
    },
    {
      "evidence_id": "E009",
      "source_type": "video",
      "source_ref": "synthetic/demo_operation.mp4",
      "claim": "使用无绒布单向擦拭密封面。",
      "locator": {"start_ms": 57000, "end_ms": 66000, "keyframe": "frames/0061.jpg"},
      "classification": "SOURCE_FACT",
      "relevance": 0.95,
      "confidence": 0.95,
      "review_status": "VERIFIED"
    },
    {
      "evidence_id": "E010",
      "source_type": "pdf",
      "source_ref": "synthetic/demo_manual.pdf",
      "claim": "新过滤件箭头应朝向设备内部。",
      "locator": {"page": 4, "paragraph": "安装方向 4.2"},
      "classification": "SOURCE_FACT",
      "relevance": 1.0,
      "confidence": 0.99,
      "review_status": "VERIFIED"
    },
    {
      "evidence_id": "E011",
      "source_type": "video",
      "source_ref": "synthetic/demo_operation.mp4",
      "claim": "新过滤件推入到底后两侧边缘齐平。",
      "locator": {"start_ms": 67000, "end_ms": 79000, "keyframe": "frames/0073.jpg"},
      "classification": "SOURCE_FACT",
      "relevance": 0.96,
      "confidence": 0.96,
      "review_status": "VERIFIED"
    },
    {
      "evidence_id": "E012",
      "source_type": "video",
      "source_ref": "synthetic/demo_operation.mp4",
      "claim": "锁紧卡扣并关闭盖板。",
      "locator": {"start_ms": 80000, "end_ms": 90000, "keyframe": "frames/0085.jpg"},
      "classification": "SOURCE_FACT",
      "relevance": 0.94,
      "confidence": 0.95,
      "review_status": "VERIFIED"
    },
    {
      "evidence_id": "E013",
      "source_type": "pdf",
      "source_ref": "synthetic/demo_manual.pdf",
      "claim": "恢复供电后确认运行指示正常且盖板周边无异常。",
      "locator": {"page": 5, "paragraph": "完成确认 5.1"},
      "classification": "SOURCE_FACT",
      "relevance": 1.0,
      "confidence": 0.99,
      "review_status": "VERIFIED"
    }
  ],
  "steps": [
    {
      "step_id": "S01",
      "title": "准备工作区",
      "action": "清理设备周边并放置警示牌",
      "object": "维护工作区",
      "prerequisites": [],
      "tools": ["warning sign"],
      "parameters": [],
      "warnings": ["保持通道畅通"],
      "success_check": "设备周边无障碍物且警示牌清晰可见",
      "evidence": ["E001"],
      "confidence": 0.96,
      "required": true,
      "status": "VERIFIED"
    },
    {
      "step_id": "S02",
      "title": "隔离电源并确认停机",
      "action": "关闭电源、挂牌并等待运行指示熄灭",
      "object": "设备电源",
      "prerequisites": ["S01"],
      "tools": ["lockout tag"],
      "parameters": [],
      "warnings": ["未确认停机不得打开维护盖板"],
      "success_check": "运行指示完全熄灭且挂牌到位",
      "evidence": ["E002", "E003"],
      "confidence": 0.99,
      "required": true,
      "status": "VERIFIED"
    },
    {
      "step_id": "S03",
      "title": "佩戴个人防护用品",
      "action": "佩戴防护手套和护目镜",
      "object": "个人防护用品",
      "prerequisites": ["S02"],
      "tools": ["protective gloves", "safety glasses"],
      "parameters": [],
      "warnings": ["防护用品破损时必须更换"],
      "success_check": "手套和护目镜均正确佩戴",
      "evidence": ["E004"],
      "confidence": 0.98,
      "required": true,
      "status": "VERIFIED"
    },
    {
      "step_id": "S04",
      "title": "打开维护盖板",
      "action": "向上打开维护盖板并确认稳定",
      "object": "维护盖板",
      "prerequisites": ["S03"],
      "tools": [],
      "parameters": [],
      "warnings": ["避免手指进入铰链夹点"],
      "success_check": "盖板完全打开且不会回落",
      "evidence": ["E005"],
      "confidence": 0.94,
      "required": true,
      "status": "VERIFIED"
    },
    {
      "step_id": "S05",
      "title": "松开过滤件卡扣",
      "action": "依次松开左右卡扣",
      "object": "过滤件卡扣",
      "prerequisites": ["S04"],
      "tools": [],
      "parameters": [],
      "warnings": ["不要强行扭转卡扣"],
      "success_check": "左右卡扣均处于释放位置",
      "evidence": ["E006"],
      "confidence": 0.95,
      "required": true,
      "status": "VERIFIED"
    },
    {
      "step_id": "S06",
      "title": "取出并封装旧过滤件",
      "action": "水平拉出旧过滤件并放入密封袋",
      "object": "旧过滤件",
      "prerequisites": ["S05"],
      "tools": ["sealed waste bag"],
      "parameters": [],
      "warnings": ["不得抖动旧过滤件"],
      "success_check": "旧过滤件已完整装入并封闭密封袋",
      "evidence": ["E007", "E008"],
      "confidence": 0.96,
      "required": true,
      "status": "VERIFIED"
    },
    {
      "step_id": "S07",
      "title": "清洁密封面",
      "action": "使用无绒布单向擦拭密封面",
      "object": "过滤件密封面",
      "prerequisites": ["S06"],
      "tools": ["lint-free cloth"],
      "parameters": [],
      "warnings": ["不要让碎屑进入设备内部"],
      "success_check": "密封面无可见残留和纤维",
      "evidence": ["E009"],
      "confidence": 0.95,
      "required": true,
      "status": "VERIFIED"
    },
    {
      "step_id": "S08",
      "title": "安装新过滤件",
      "action": "按箭头方向推入新过滤件直至两侧齐平",
      "object": "新过滤件",
      "prerequisites": ["S07"],
      "tools": ["replacement filter"],
      "parameters": [],
      "warnings": ["方向错误时不得强行推入"],
      "success_check": "箭头朝向设备内部且两侧边缘齐平",
      "evidence": ["E010", "E011"],
      "confidence": 0.98,
      "required": true,
      "status": "VERIFIED"
    },
    {
      "step_id": "S09",
      "title": "复位并检查运行状态",
      "action": "锁紧卡扣、关闭盖板、移除挂牌并恢复供电",
      "object": "盖板和设备电源",
      "prerequisites": ["S08"],
      "tools": [],
      "parameters": [],
      "warnings": ["异常声响或指示异常时立即断电"],
      "success_check": "卡扣锁紧、盖板闭合、运行指示正常且周边无异常",
      "evidence": ["E012", "E013"],
      "confidence": 0.98,
      "required": true,
      "status": "VERIFIED"
    }
  ]
}
